[
  {
    "id": 1,
    "name": "John Smith",
    "email": "john.smith@example.com",
    "phone": "(555) 123-4567",
    "company": "Acme Corporation",
    "title": "CTO",
    "department": "Information Technology",
    "address": "123 Tech Lane, San Francisco, CA 94105",
    "notes": "Prefers email communication. Technical decision maker for all IT projects.",
    "lastContactDate": "2023-11-18",
    "birthday": "1975-04-12",
    "linkedin": "linkedin.com/in/johnsmith",
    "twitter": "@johnsmith",
    "leadSource": "Conference",
    "leadStatus": "Qualified",
    "preferredContactMethod": "Email",
    "timezone": "America/Los_Angeles",
    "tags": ["technical", "decision-maker", "enterprise"],
    "createdAt": "2022-05-15",
    "updatedAt": "2023-11-18"
  },
  {
    "id": 2,
    "name": "Sarah Johnson",
    "email": "sarah.j@example.com",
    "phone": "(555) 987-6543",
    "company": "Globex Inc",
    "title": "Marketing Director",
    "department": "Marketing",
    "address": "456 Market Street, Chicago, IL 60601",
    "notes": "Responds quickly to calls. Has budget authority for marketing projects.",
    "lastContactDate": "2023-11-20",
    "birthday": "1982-08-23",
    "linkedin": "linkedin.com/in/sarahjohnson",
    "twitter": "@sarahj_marketing",
    "leadSource": "Referral",
    "leadStatus": "Customer",
    "preferredContactMethod": "Phone",
    "timezone": "America/Chicago",
    "tags": ["marketing", "decision-maker", "quick-responder"],
    "createdAt": "2022-09-10",
    "updatedAt": "2023-11-20"
  },
  {
    "id": 3,
    "name": "Michael Brown",
    "email": "m.brown@example.com",
    "phone": "(555) 456-7890",
    "company": "Initech",
    "title": "Operations Manager",
    "department": "Operations",
    "address": "789 Office Park, Austin, TX 78701",
    "notes": "Prefers detailed proposals. Needs to see clear ROI for all projects.",
    "lastContactDate": "2023-11-15",
    "birthday": "1979-11-30",
    "linkedin": "linkedin.com/in/michaelbrown",
    "twitter": null,
    "leadSource": "Website",
    "leadStatus": "Customer",
    "preferredContactMethod": "Email",
    "timezone": "America/Chicago",
    "tags": ["operations", "detail-oriented", "roi-focused"],
    "createdAt": "2022-03-22",
    "updatedAt": "2023-11-15"
  },
  {
    "id": 4,
    "name": "Emily Davis",
    "email": "emily.davis@example.com",
    "phone": "(555) 234-5678",
    "company": "Umbrella Corp",
    "title": "Chief Innovation Officer",
    "department": "Executive",
    "address": "101 Innovation Drive, Boston, MA 02110",
    "notes": "Very busy, keep communications concise. Interested in cutting-edge solutions.",
    "lastContactDate": "2023-11-10",
    "birthday": "1980-02-14",
    "linkedin": "linkedin.com/in/emilydavis",
    "twitter": "@emilyd_innovation",
    "leadSource": "Conference",
    "leadStatus": "Qualified",
    "preferredContactMethod": "Text",
    "timezone": "America/New_York",
    "tags": ["executive", "innovation", "busy"],
    "createdAt": "2022-11-05",
    "updatedAt": "2023-11-10"
  },
  {
    "id": 5,
    "name": "Robert Wilson",
    "email": "rwilson@example.com",
    "phone": "(555) 876-5432",
    "company": "Stark Industries",
    "title": "Head of Security",
    "department": "Security",
    "address": "1 Stark Tower, Los Angeles, CA 90001",
    "notes": "Very security conscious. All proposals must address compliance requirements.",
    "lastContactDate": "2023-11-22",
    "birthday": "1972-07-07",
    "linkedin": "linkedin.com/in/robertwilson",
    "twitter": null,
    "leadSource": "Partner Referral",
    "leadStatus": "Qualified",
    "preferredContactMethod": "Phone",
    "timezone": "America/Los_Angeles",
    "tags": ["security", "compliance", "enterprise"],
    "createdAt": "2022-08-15",
    "updatedAt": "2023-11-22"
  },
  {
    "id": 6,
    "name": "Jennifer Lee",
    "email": "j.lee@example.com",
    "phone": "(555) 345-6789",
    "company": "Wayne Enterprises",
    "title": "Learning & Development Manager",
    "department": "Human Resources",
    "address": "1007 Mountain Drive, Gotham City, NJ 07101",
    "notes": "Looking for innovative training solutions. Budget approval required from HR Director.",
    "lastContactDate": "2023-11-05",
    "birthday": "1985-12-18",
    "linkedin": "linkedin.com/in/jenniferlee",
    "twitter": "@jenlee_learning",
    "leadSource": "Website",
    "leadStatus": "Prospect",
    "preferredContactMethod": "Email",
    "timezone": "America/New_York",
    "tags": ["hr", "training", "corporate"],
    "createdAt": "2023-01-20",
    "updatedAt": "2023-11-05"
  },
  {
    "id": 7,
    "name": "David Miller",
    "email": "d.miller@example.com",
    "phone": "(555) 654-3210",
    "company": "Cyberdyne Systems",
    "title": "Government Relations Director",
    "department": "Public Sector",
    "address": "123 Government Way, Washington, DC 20001",
    "notes": "Former government employee with strong connections. Formal communication style preferred.",
    "lastContactDate": "2023-11-17",
    "birthday": "1968-05-20",
    "linkedin": "linkedin.com/in/davidmiller",
    "twitter": null,
    "leadSource": "Industry Event",
    "leadStatus": "Qualified",
    "preferredContactMethod": "Email",
    "timezone": "America/New_York",
    "tags": ["government", "formal", "connected"],
    "createdAt": "2022-06-12",
    "updatedAt": "2023-11-17"
  },
  {
    "id": 8,
    "name": "Lisa Chen",
    "email": "l.chen@example.com",
    "phone": "(555) 789-0123",
    "company": "Oscorp",
    "title": "Supply Chain Director",
    "department": "Logistics",
    "address": "888 Logistics Avenue, Seattle, WA 98101",
    "notes": "Analytical decision maker. Needs to see data-backed proposals with clear metrics.",
    "lastContactDate": "2023-11-21",
    "birthday": "1983-09-04",
    "linkedin": "linkedin.com/in/lisachen",
    "twitter": "@lisa_logistics",
    "leadSource": "Trade Show",
    "leadStatus": "Prospect",
    "preferredContactMethod": "Email",
    "timezone": "America/Los_Angeles",
    "tags": ["logistics", "analytical", "data-driven"],
    "createdAt": "2023-02-28",
    "updatedAt": "2023-11-21"
  }
]
